{
  "id": "0000000000000000000000000000000000000000000000000000000000000000",
  "pubkey": "dd7936bbf3d8dfd68a7b42412fcb1fe828b51c8b7e63d818e0fcc37d2f473c73",
  "created_at": 1787771198,
  "kind": 1,
  "tags": [
    [
      "imeta",
      "url http://192.168.50.215:3000/6729f30a94fbd96f5f8472165c5139faa53b13f81f44313b7520235cf1fb59e4.jpeg",
      "m image/jpeg",
      "x 6729f30a94fbd96f5f8472165c5139faa53b13f81f44313b7520235cf1fb59e4",
      "ox b97df703b7e855e5510502d9766f1e45f00e709a2e176f3774b55c22f9487e1b",
      "size 1428",
      "dim 96x96",
      "thumb http://192.168.50.215:3000/132ad6dae7394ba44789f998c63c4ba8cc17b943755f9d940305f2093a91a7c2.webp",
      "alt Object #0003 detected in DWARF 3 video"
    ]
  ],
  "content": "File: DWARF3_TELE_2026-08-12-20-04-00-273_20260812200537458.mp4\nDatetime: 2026-08-26 21:04:37\nObjects:\n#0003\nhttp://192.168.50.215:3000/6729f30a94fbd96f5f8472165c5139faa53b13f81f44313b7520235cf1fb59e4.jpeg",
  "sig": "00000000000000000000000000000000000000000000000000000000000000000000000000000000000000000000000000000000000000000000000000000000"
}
